<?xml version="1.0" encoding="UTF-8"?>
<!DOCTYPE document SYSTEM "matrimonios.dtd">
<document>
  <ACTES>

    <ACTE num="5613">5643) <date>17-5-1777</date>: <epoux don="true">Dn.
    <prenom>Agustín</prenom> <prenom>Casimiro</prenom> de <nom
    de="true">AGUIRRE</nom>, natural de la Villa de <naissance-lieu>Donamaría,
    Obispado de Pamplona</naissance-lieu>, hijo legítimo de <pere don="true">
    Dn. <prenom>Francisco</prenom> <prenom>Casimiro</prenom> de <nom
    de="true">Aguirre</nom></pere> y de <mere don="true"> Da.
    <prenom>María</prenom> <prenom>Micaela</prenom> de <nom
    de="true">Micheo</nom> y <nom y="true">Ustariz</nom>,</mere></epoux> con
    <epouse don="true">Da. <prenom>María</prenom> <prenom>Josefa</prenom>
    <prenom>Engracia</prenom> <nom>ALONSO</nom> de la <nom de="true"
    la="true">JARROTA</nom> y (<nom y="true">ROZAS</nom>), natural de
    <naissance-lieu>ésta</naissance-lieu>, hija legítima de <pere don="true">
    Dn. <prenom>Domingo</prenom> <nom>Alonso</nom> de <nom
    de="true">Lajarrota</nom> y <nom y="true">Rozas</nom>,
    <condition>Caballero de la Orden de Alcántara</condition></pere> <mere
    don="true"> y de Da. <prenom>María</prenom> <prenom>Josefa</prenom> de la
    <nom de="true" la="true">Quintana</nom> y <nom y="true">Riglos</nom>.
    </mere></epouse>. Ts.: <temoins> los padres de la contrayente,
    </temoins>(f. 159).</ACTE>

    <ACTE num="5614">5644) <date>26-5-1777</date>: <epoux>José VIÑAS, natural
    de la ciudad de Mataró, Cataluña, hijo de <pere> Francisco Viñas</pere> y
    de <mere> María Viñas,</mere></epoux> con <epouse>Da. María Inés PEREYRA,
    natural de ésta, hija de <pere> Ricardo Pereyra</pere> y de <mere> María
    Josefa Cabral. </mere></epouse>. Ts.: <temoins><temoin> Dn. Nicolás
    Román</temoin> y <temoin>Da. Lorenza Pereyra. </temoin></temoins>(f.
    159).</ACTE>

    <ACTE num="6480">6519) <date>23-6-1804</date>: <epoux don="true">Dn.
    Gerardo BOSCH, natural de la ciudad de <naissance-lieu>Mataró, Obispado de
    Barcelona, Principado de Cataluña</naissance-lieu>, hijo legítimo de <pere
    don="true"> Dn. <prenom>Gerardo</prenom> <nom>Bosch</nom></pere> y de
    <mere don="true"> Da. <prenom>Isabel</prenom>
    <nom>Alvareda</nom>,</mere></epoux> con <epouse don="true">Da.
    <prenom>Juana</prenom> <prenom>Josefa</prenom> de <nom
    de="true">AGUIRRE</nom>, natural de <naissance-lieu>ésta</naissance-lieu>,
    hija legítima de <pere don="true"> Dn. <prenom>Cristóbal</prenom> de
    <nom>Aguirre</nom></pere> y de <mere don="true"> Da.
    <prenom>Manuela</prenom> <nom>López</nom> de <nom de="true">Anaya</nom>.
    </mere></epouse>. Ts.: <temoins><temoin don="true"> Dn.
    <prenom>Cristóbal</prenom> de <nom de="true">Aguirre</nom></temoin>,
    <temoin don="true" epouse="true">su esposa Da. <prenom>Manuela</prenom>
    <nom>López</nom> [de <nom de="true">Anaya</nom>]</temoin>, <temoin
    don="true">Dn. <prenom>Domingo</prenom> <nom>Miró</nom></temoin> y <temoin
    don="true">Dn. <prenom>Jaime</prenom> <nom>Batista</nom></temoin>,
    </temoins>(f. 435v.).</ACTE>

    <ACTE num="14008">14026) <date>1801</date>: <epoux>Bartolo ROBLE,</epoux>
    con <epouse>Josefa SANCHEZ,</epouse>. 175).</ACTE>

    <ACTE num="14009">14027) <date>1801</date>: <epoux>José LOPEZ,</epoux> con
    <epouse>Casimira CARAVAJAL.</epouse>. 175v).</ACTE>

    <ACTE num="14010">14028) <date>1801</date>: <epoux>Melcor
    VILLANUEVA,</epoux> con <epouse>Francisca SUAREZ.</epouse>. 176).</ACTE>

    <ACTE num="14011">14029) <date>1801</date>: <epoux>Pedro ACEVEDO,</epoux>
    con <epouse>Pascuala LERMA.</epouse>. 176v).</ACTE>

    <ACTE num="14012">14030) <date>1801</date>: <epoux>Juan Antonio
    MARQUEZ,</epoux> con <epouse>Josefa MURAÑA.</epouse>. 176).</ACTE>

    <ACTE num="14013">14031) <date>1801</date>: <epoux>José Antonio de la
    ROSA,</epoux> con <epouse>Juana BAEZ.</epouse>. 177).</ACTE>

    <ACTE num="14014">14032) <date>1801</date>: <epoux>José M. de
    LEON,</epoux> con <epouse>Antonia PAZ.</epouse>. 177v).</ACTE>
  </ACTES>
</document>
