<?xml version="1.0" encoding="UTF-8"?>
<!DOCTYPE document SYSTEM "matrimonios.dtd">
<document><ACTES>
<ACTE num="5"> 1)<date>4-2-1656</date> :     <epoux id="1"><condition>Capitán</condition> <prenom>Juan</prenom>     <nom>ZACARIAS</nom> de la <nom de="true" la="true">SIERRA</nom> y     <nom>MORALES</nom> </epoux>, con <epouse don="true" id="2">Da.     <prenom>María</prenom> de <nom de="true">CARAVAJAL</nom>, <veuve id="3">viuda del     <condition>Capitán</condition> <prenom>Cristóbal</prenom>     <nom>Cabral</nom> </veuve> </epouse>.<temoins>Ts.:     el<temoin id="4"><condition>Capitán</condition><prenom>Diego</prenom><nom>Gutiérrez</nom>de     <nom de="true">Humanes</nom></temoin><temoin id="5"><prenom>Juan</prenom>de<nom>Ibarra     o Izarra</nom></temoin>,<temoin id="6">el<condition>Alférez</condition>     <prenom>Juan</prenom> <nom>Rodríguez</nom> <nom>Estela</nom> </temoin>, y     otros muchos</temoins>, (f. 1).</ACTE>
<ACTE num="8193"> 8233) <date>22-9-1755</date> :     <epoux id="7"><prenom>Juan Esteban</prenom>de <nom de="true">OLEA</nom>,     <condition>indio</condition>, <naissance-lieu>natural de     Tucumán</naissance-lieu>, hijo legítimo de <pere id="9">     <prenom>Agustín</prenom> de <nom de="true">Olea</nom> </pere> y de <mere id="10">         <prenom>Cristina</prenom>       </mere>, indios</epoux>, con <epouse id="8"><prenom>María Pascuala</prenom>     <nom>ORTIZ</nom>, española, <naissance-lieu>natural de     ésta</naissance-lieu>, hija legítima de <pere id="11">         <prenom>Pedro</prenom>          <nom>Ortiz</nom>       </pere>, difunto, y de <mere id="12">         <prenom>Juana Gregoria</prenom>          <nom>Ramírez</nom>       </mere></epouse>. <temoins>Ts.: <temoin id="13">         <prenom>Francisco</prenom>          <nom>Guzmán</nom>       </temoin>, y <temoin id="14">         <prenom>Sabina</prenom>          <nom>Alvarado</nom>       </temoin></temoins>. Nota: C 8/214, "Juan Esteban Olea, mestizo al     parecer, y María Pascuala Ortiz, que se duda si es española, pero ella     dice que sí, y pobre", (f. 130).</ACTE>
<ACTE num="7232">7277) <date>14-5-1815</date>: <epoux id="414">Señor     <condition>Coronel Mayor </condition>Dn. <prenom>Juan     </prenom><prenom>Martín</prenom> de <nom de="true">PUEYRREDON</nom>,     natural de <naissance-lieu>ésta</naissance-lieu>, hijo legítimo de     <pere id="526">Dn. <prenom>Juan</prenom> <nom>Martín</nom> de <nom de="true">Pueyrredón</nom></pere> y de Da. <mere id="415">         <prenom>Rita </prenom>          <nom>Dogan</nom>       </mere></epoux>, con <epouse id="525">Da. <prenom>María     </prenom><prenom>Calixta</prenom> <nom>TELLECHEA</nom>, natural de     <naissance-lieu>ésta</naissance-lieu>, hija legítima de <pere don="true" id="384">Dn. <prenom>Francisco </prenom><nom>Tellechea</nom> </pere>y de     Da. <mere don="true" id="385">         <prenom>Matea </prenom>          <nom>Caviedes</nom>       </mere></epouse>. Ts.:<temoins conjoints="true"> <temoin don="true" id="527">Dn.     <prenom>Manuel </prenom><nom>Martínez</nom> <nom>García</nom> </temoin>y     su esposa <temoin don="true" epouse="true" id="386">Da. <prenom>Damasia     </prenom><nom>Caviedes</nom></temoin></temoins>. (f. 141v.).</ACTE>
<ACTE num="4097">4108)<date>8-12-1750</date>: <epoux id="15">Dn. <prenom>Francisco     Antonio</prenom> de <nom de="true">CONGET</nom></epoux>, con <epouse id="16">Da.     <prenom>Antonia Margarita</prenom> <nom>de     RAMOS</nom><naissance-lieu>naturales de ésta</naissance-lieu>,</epouse> .     Ts.: (<temoins> <temoin id="17"> Dn. <prenom>Mateo</prenom> <nom>de     Ramos</nom></temoin> y <temoin id="18">Da. <prenom>Margarita</prenom>     <nom>Monzón</nom> <nom>Díaz</nom> </temoin></temoins>), (f. 23).</ACTE>

</ACTES></document>
